{
  "kind": "DEBATEAI_SCORECARD",
  "formatVersion": 1,
  "scorecardVersion": 1,
  "createdAt": "2026-09-26",
  "testSetVersion": "example-test-set-v0",
  "engineCompatibility": { "minEngineVersion": "0.1.0", "maxEngineVersion": null },
  "languages": ["ro", "en"],
  "candidates": [
    { "candidateId": "openai-alpha-low", "vendor": "OpenAI", "maker": "OpenAI", "modelId": "example-openai-alpha", "thinkingLevel": "low", "accessRoutes": [{ "kind": "API" }, { "kind": "SUBSCRIPTION", "tool": "codex" }], "apiPrice": { "inputMicrosPerMTok": 1250000, "outputMicrosPerMTok": 10000000, "asOf": "2026-09-20", "source": "made-up example price" }, "contextWindowTokens": 400000 },
    { "candidateId": "openai-alpha-high", "vendor": "OpenAI", "maker": "OpenAI", "modelId": "example-openai-alpha", "thinkingLevel": "high", "accessRoutes": [{ "kind": "API" }, { "kind": "SUBSCRIPTION", "tool": "codex" }], "apiPrice": { "inputMicrosPerMTok": 1250000, "outputMicrosPerMTok": 10000000, "asOf": "2026-09-20", "source": "made-up example price" }, "contextWindowTokens": 400000 },
    { "candidateId": "anthropic-beta-medium", "vendor": "Anthropic", "maker": "Anthropic", "modelId": "example-anthropic-beta", "thinkingLevel": "medium", "accessRoutes": [{ "kind": "API" }, { "kind": "SUBSCRIPTION", "tool": "claude" }], "apiPrice": { "inputMicrosPerMTok": 3000000, "outputMicrosPerMTok": 15000000, "asOf": "2026-09-20", "source": "made-up example price" }, "contextWindowTokens": 200000 },
    { "candidateId": "anthropic-gamma-low", "vendor": "Anthropic", "maker": "Anthropic", "modelId": "example-anthropic-gamma", "thinkingLevel": "low", "accessRoutes": [{ "kind": "API" }, { "kind": "SUBSCRIPTION", "tool": "claude" }], "apiPrice": { "inputMicrosPerMTok": 800000, "outputMicrosPerMTok": 4000000, "asOf": "2026-09-20", "source": "made-up example price" }, "contextWindowTokens": 200000 },
    { "candidateId": "google-delta-high", "vendor": "Google", "maker": "Google", "modelId": "example-google-delta-high", "thinkingLevel": "DEFAULT_ONLY", "accessRoutes": [{ "kind": "SUBSCRIPTION", "tool": "agy" }], "apiPrice": null, "contextWindowTokens": 1000000 },
    { "candidateId": "zai-epsilon-high", "vendor": "Z.AI", "maker": "Z.AI", "modelId": "example-zai-epsilon", "thinkingLevel": "high", "accessRoutes": [{ "kind": "SUBSCRIPTION", "tool": "pi" }], "apiPrice": { "inputMicrosPerMTok": 600000, "outputMicrosPerMTok": 2200000, "asOf": "2026-09-20", "source": "made-up example price" }, "contextWindowTokens": 16000 },
    { "candidateId": "xai-zeta-medium", "vendor": "xAI", "maker": "xAI", "modelId": "example-xai-zeta", "thinkingLevel": "medium", "accessRoutes": [{ "kind": "API" }, { "kind": "SUBSCRIPTION", "tool": "grok" }], "apiPrice": { "inputMicrosPerMTok": 2000000, "outputMicrosPerMTok": 10000000, "asOf": "2026-09-20", "source": "made-up example price" }, "contextWindowTokens": 256000 }
  ],
  "roles": {
    "POSITION": [
      { "candidateId": "anthropic-beta-medium", "tier": "TOP", "quality": { "score": 86, "low": 82, "high": 90 }, "qualityByLanguage": { "ro": { "score": 84, "low": 79, "high": 89 }, "en": { "score": 88, "low": 84, "high": 92 } }, "typicalCall": { "inputTokens": 1400, "outputTokens": 900, "thinkingTokens": 600, "seconds": 21.5 }, "tags": [{ "code": "HEDGES_OPENING", "strength": "WEAK", "text": "Sometimes opens with a hedge instead of a position." }], "promptVersion": "standard", "itemsMeasured": 60, "measuredAt": "2026-09-24" },
      { "candidateId": "openai-alpha-high", "tier": "TOP", "quality": { "score": 85, "low": 80, "high": 89 }, "qualityByLanguage": null, "typicalCall": { "inputTokens": 1400, "outputTokens": 950, "thinkingTokens": 1800, "seconds": 28 }, "tags": [], "promptVersion": "standard", "itemsMeasured": 60, "measuredAt": "2026-09-24" },
      { "candidateId": "openai-alpha-low", "tier": "GOOD_VALUE", "quality": { "score": 81, "low": 76, "high": 85 }, "qualityByLanguage": null, "typicalCall": { "inputTokens": 1400, "outputTokens": 900, "thinkingTokens": 500, "seconds": 14 }, "tags": [], "promptVersion": "standard", "itemsMeasured": 60, "measuredAt": "2026-09-24" },
      { "candidateId": "google-delta-high", "tier": "GOOD_VALUE", "quality": { "score": 80, "low": 75, "high": 85 }, "qualityByLanguage": null, "typicalCall": { "inputTokens": 1400, "outputTokens": 900, "thinkingTokens": null, "seconds": 16 }, "tags": [], "promptVersion": "standard", "itemsMeasured": 60, "measuredAt": "2026-09-24" },
      { "candidateId": "anthropic-gamma-low", "tier": "GOOD_VALUE", "quality": { "score": 78, "low": 73, "high": 83 }, "qualityByLanguage": null, "typicalCall": { "inputTokens": 1400, "outputTokens": 850, "thinkingTokens": 300, "seconds": 11.5 }, "tags": [], "promptVersion": "standard", "itemsMeasured": 60, "measuredAt": "2026-09-24" },
      { "candidateId": "zai-epsilon-high", "tier": "GOOD_VALUE", "quality": { "score": 74, "low": 68, "high": 80 }, "qualityByLanguage": null, "typicalCall": { "inputTokens": 1400, "outputTokens": 800, "thinkingTokens": 700, "seconds": 19 }, "tags": [], "promptVersion": "standard", "itemsMeasured": 40, "measuredAt": "2026-09-24" },
      { "candidateId": "xai-zeta-medium", "tier": "AVOID", "quality": { "score": 62, "low": 55, "high": 69 }, "qualityByLanguage": null, "typicalCall": { "inputTokens": 1400, "outputTokens": 700, "thinkingTokens": 400, "seconds": 12 }, "tags": [{ "code": "OFF_QUESTION", "strength": "STRONG", "text": "Often answers a nearby question instead of the one asked." }], "promptVersion": "standard", "itemsMeasured": 40, "measuredAt": "2026-09-24" }
    ],
    "SUPPORT_ATTACK": [
      { "candidateId": "openai-alpha-high", "tier": "TOP", "quality": { "score": 84, "low": 79, "high": 88 }, "qualityByLanguage": null, "typicalCall": { "inputTokens": 2600, "outputTokens": 800, "thinkingTokens": 1600, "seconds": 26 }, "tags": [], "promptVersion": "standard", "itemsMeasured": 60, "measuredAt": "2026-09-24" },
      { "candidateId": "anthropic-beta-medium", "tier": "TOP", "quality": { "score": 83, "low": 78, "high": 87 }, "qualityByLanguage": null, "typicalCall": { "inputTokens": 2600, "outputTokens": 800, "thinkingTokens": 500, "seconds": 20 }, "tags": [], "promptVersion": "standard", "itemsMeasured": 60, "measuredAt": "2026-09-24" },
      { "candidateId": "openai-alpha-low", "tier": "GOOD_VALUE", "quality": { "score": 80, "low": 75, "high": 84 }, "qualityByLanguage": null, "typicalCall": { "inputTokens": 2600, "outputTokens": 800, "thinkingTokens": 450, "seconds": 13 }, "tags": [], "promptVersion": "standard", "itemsMeasured": 60, "measuredAt": "2026-09-24" },
      { "candidateId": "google-delta-high", "tier": "GOOD_VALUE", "quality": { "score": 79, "low": 74, "high": 84 }, "qualityByLanguage": null, "typicalCall": { "inputTokens": 2600, "outputTokens": 800, "thinkingTokens": null, "seconds": 15 }, "tags": [], "promptVersion": "standard", "itemsMeasured": 60, "measuredAt": "2026-09-24" },
      { "candidateId": "anthropic-gamma-low", "tier": "GOOD_VALUE", "quality": { "score": 77, "low": 72, "high": 82 }, "qualityByLanguage": null, "typicalCall": { "inputTokens": 2600, "outputTokens": 800, "thinkingTokens": 250, "seconds": 10.5 }, "tags": [], "promptVersion": "standard", "itemsMeasured": 60, "measuredAt": "2026-09-24" },
      { "candidateId": "zai-epsilon-high", "tier": "GOOD_VALUE", "quality": { "score": 73, "low": 67, "high": 79 }, "qualityByLanguage": null, "typicalCall": { "inputTokens": 2600, "outputTokens": 800, "thinkingTokens": 650, "seconds": 18 }, "tags": [], "promptVersion": "standard", "itemsMeasured": 40, "measuredAt": "2026-09-24" },
      { "candidateId": "xai-zeta-medium", "tier": "AVOID", "quality": { "score": 64, "low": 57, "high": 71 }, "qualityByLanguage": null, "typicalCall": { "inputTokens": 2600, "outputTokens": 800, "thinkingTokens": 380, "seconds": 11 }, "tags": [], "promptVersion": "standard", "itemsMeasured": 40, "measuredAt": "2026-09-24" }
    ],
    "CROSS_EXCHANGE": [
      { "candidateId": "anthropic-beta-medium", "tier": "TOP", "quality": { "score": 82, "low": 77, "high": 87 }, "qualityByLanguage": null, "typicalCall": { "inputTokens": 3200, "outputTokens": 850, "thinkingTokens": 550, "seconds": 22 }, "tags": [], "promptVersion": "standard", "itemsMeasured": 60, "measuredAt": "2026-09-24" },
      { "candidateId": "openai-alpha-high", "tier": "TOP", "quality": { "score": 82, "low": 77, "high": 86 }, "qualityByLanguage": null, "typicalCall": { "inputTokens": 3200, "outputTokens": 850, "thinkingTokens": 1700, "seconds": 27 }, "tags": [], "promptVersion": "standard", "itemsMeasured": 60, "measuredAt": "2026-09-24" },
      { "candidateId": "openai-alpha-low", "tier": "GOOD_VALUE", "quality": { "score": 78, "low": 73, "high": 83 }, "qualityByLanguage": null, "typicalCall": { "inputTokens": 3200, "outputTokens": 850, "thinkingTokens": 480, "seconds": 14 }, "tags": [], "promptVersion": "standard", "itemsMeasured": 60, "measuredAt": "2026-09-24" },
      { "candidateId": "google-delta-high", "tier": "GOOD_VALUE", "quality": { "score": 78, "low": 73, "high": 83 }, "qualityByLanguage": null, "typicalCall": { "inputTokens": 3200, "outputTokens": 850, "thinkingTokens": null, "seconds": 16 }, "tags": [], "promptVersion": "standard", "itemsMeasured": 60, "measuredAt": "2026-09-24" },
      { "candidateId": "anthropic-gamma-low", "tier": "GOOD_VALUE", "quality": { "score": 75, "low": 70, "high": 80 }, "qualityByLanguage": null, "typicalCall": { "inputTokens": 3200, "outputTokens": 850, "thinkingTokens": 270, "seconds": 11 }, "tags": [], "promptVersion": "standard", "itemsMeasured": 60, "measuredAt": "2026-09-24" },
      { "candidateId": "zai-epsilon-high", "tier": "GOOD_VALUE", "quality": { "score": 71, "low": 65, "high": 77 }, "qualityByLanguage": null, "typicalCall": { "inputTokens": 3200, "outputTokens": 850, "thinkingTokens": 690, "seconds": 19 }, "tags": [], "promptVersion": "standard", "itemsMeasured": 40, "measuredAt": "2026-09-24" },